{
    "chronometricAgeRemarks": "One of the Crassostrea virginica right valve specimens from North Midden Feature 17 was chosen for AMS dating, but it is unclear exactly which specimen it was.",
    "chronometricAgeProtocol": "radiocarbon AMS",
    "chronometricAgeUncertaintyInYears": 200,
    "earliestChronometricAgeReferenceSystem": "BCE",
    "earliestChronometricAge": 2000
}